{
  "reportType": "native-command-simulation",
  "schemaVersion": 1,
  "commandId": "winre-plan-reagentc",
  "commandName": "reagentc",
  "plannedCommand": "reagentc /setreimage /path R:\\Recovery\\WindowsRE /target W:\\Windows",
  "simulatedExitCode": 0,
  "simulatedStdout": "simulated WinRE plan completed",
  "simulatedStderr": ""
}
